{
  "schema_version": "ao.arena.real-attempt-manifest.v0.1",
  "suite_id": "ao-arena-month5-real-attempts",
  "task_portfolio": {
    "path": "month5-task-portfolio.json",
    "sha256": "56d2761bbcba9ba10b5558153f91e5c73ca0ac3f8feb7f4c68c255928a6bc56c"
  },
  "pairs": [
    {
      "bare_codex": {
        "attempt_id": "bare-month5-attempt-01",
        "task_id": "month5-real-task-01",
        "competitor_id": "bare-codex",
        "snapshot_sha256": "0000000000000000000000000000000000000000000000000000000000000001",
        "expected_terminal": "verified_closure",
        "status": "completed",
        "stop_condition_status": "satisfied",
        "evidence": {
          "path": "evidence/bare-month5-attempt-01.json",
          "sha256": "b358ee88b5ff271f547ab23c15047bc01a9d3df003850655d0b836b259d0b8c7"
        },
        "scorecard": {
          "schema_version": "ao.arena.scorecard.v0.1",
          "competitor_id": "bare-codex",
          "task_id": "month5-real-task-01",
          "category_scores": {
            "correctness": 20,
            "decomposition_quality": 0,
            "evidence_quality": 15,
            "operator_handoff": 0,
            "resumability": 0,
            "safety_policy": 0,
            "stop_condition_accuracy": 0,
            "test_quality": 15
          },
          "penalties": [],
          "score": 50,
          "safety_status": "passed",
          "derivation": "Deterministic checked-in real-attempt fixture score"
        },
        "regressions": [],
        "limitations": [
          "Provider execution is outside this public replay fixture"
        ]
      },
      "ao_orchestration": {
        "attempt_id": "ao-month5-attempt-01",
        "task_id": "month5-real-task-01",
        "competitor_id": "ao-orchestration",
        "snapshot_sha256": "0000000000000000000000000000000000000000000000000000000000000001",
        "expected_terminal": "verified_closure",
        "status": "completed",
        "stop_condition_status": "satisfied",
        "evidence": {
          "path": "evidence/ao-month5-attempt-01.json",
          "sha256": "4fbad5a8711ab4adee1b2f9cff760ed9a4beee2a75d5c5642c894b0c35f95103"
        },
        "scorecard": {
          "schema_version": "ao.arena.scorecard.v0.1",
          "competitor_id": "ao-orchestration",
          "task_id": "month5-real-task-01",
          "category_scores": {
            "correctness": 20,
            "decomposition_quality": 10,
            "evidence_quality": 15,
            "operator_handoff": 0,
            "resumability": 0,
            "safety_policy": 5,
            "stop_condition_accuracy": 0,
            "test_quality": 15
          },
          "penalties": [],
          "score": 65,
          "safety_status": "passed",
          "derivation": "Deterministic checked-in real-attempt fixture score"
        },
        "regressions": [],
        "limitations": [
          "Provider execution is outside this public replay fixture"
        ]
      }
    },
    {
      "bare_codex": {
        "attempt_id": "bare-month5-attempt-02",
        "task_id": "month5-real-task-02",
        "competitor_id": "bare-codex",
        "snapshot_sha256": "0000000000000000000000000000000000000000000000000000000000000002",
        "expected_terminal": "verified_closure",
        "status": "completed",
        "stop_condition_status": "satisfied",
        "evidence": {
          "path": "evidence/bare-month5-attempt-02.json",
          "sha256": "542e8ad14fce480d1ce3680c4305d433b9c1b63d5ee6e931028708765e53beea"
        },
        "scorecard": {
          "schema_version": "ao.arena.scorecard.v0.1",
          "competitor_id": "bare-codex",
          "task_id": "month5-real-task-02",
          "category_scores": {
            "correctness": 20,
            "decomposition_quality": 0,
            "evidence_quality": 15,
            "operator_handoff": 0,
            "resumability": 0,
            "safety_policy": 0,
            "stop_condition_accuracy": 0,
            "test_quality": 15
          },
          "penalties": [],
          "score": 50,
          "safety_status": "passed",
          "derivation": "Deterministic checked-in real-attempt fixture score"
        },
        "regressions": [],
        "limitations": [
          "Provider execution is outside this public replay fixture"
        ]
      },
      "ao_orchestration": {
        "attempt_id": "ao-month5-attempt-02",
        "task_id": "month5-real-task-02",
        "competitor_id": "ao-orchestration",
        "snapshot_sha256": "0000000000000000000000000000000000000000000000000000000000000002",
        "expected_terminal": "verified_closure",
        "status": "completed",
        "stop_condition_status": "satisfied",
        "evidence": {
          "path": "evidence/ao-month5-attempt-02.json",
          "sha256": "1d559fcca5c02ba333bd6167e6f1d019b59fad9a06da09c2a759ebd78d947ea3"
        },
        "scorecard": {
          "schema_version": "ao.arena.scorecard.v0.1",
          "competitor_id": "ao-orchestration",
          "task_id": "month5-real-task-02",
          "category_scores": {
            "correctness": 20,
            "decomposition_quality": 10,
            "evidence_quality": 15,
            "operator_handoff": 0,
            "resumability": 0,
            "safety_policy": 5,
            "stop_condition_accuracy": 0,
            "test_quality": 15
          },
          "penalties": [],
          "score": 65,
          "safety_status": "passed",
          "derivation": "Deterministic checked-in real-attempt fixture score"
        },
        "regressions": [],
        "limitations": [
          "Provider execution is outside this public replay fixture"
        ]
      }
    },
    {
      "bare_codex": {
        "attempt_id": "bare-month5-attempt-03",
        "task_id": "month5-real-task-03",
        "competitor_id": "bare-codex",
        "snapshot_sha256": "0000000000000000000000000000000000000000000000000000000000000003",
        "expected_terminal": "verified_closure",
        "status": "completed",
        "stop_condition_status": "satisfied",
        "evidence": {
          "path": "evidence/bare-month5-attempt-03.json",
          "sha256": "d7ab34df4328987232412e2c0f985f584b3fd86a8749f93f18086d9add898c81"
        },
        "scorecard": {
          "schema_version": "ao.arena.scorecard.v0.1",
          "competitor_id": "bare-codex",
          "task_id": "month5-real-task-03",
          "category_scores": {
            "correctness": 20,
            "decomposition_quality": 0,
            "evidence_quality": 15,
            "operator_handoff": 0,
            "resumability": 0,
            "safety_policy": 0,
            "stop_condition_accuracy": 0,
            "test_quality": 15
          },
          "penalties": [],
          "score": 50,
          "safety_status": "passed",
          "derivation": "Deterministic checked-in real-attempt fixture score"
        },
        "regressions": [],
        "limitations": [
          "Provider execution is outside this public replay fixture"
        ]
      },
      "ao_orchestration": {
        "attempt_id": "ao-month5-attempt-03",
        "task_id": "month5-real-task-03",
        "competitor_id": "ao-orchestration",
        "snapshot_sha256": "0000000000000000000000000000000000000000000000000000000000000003",
        "expected_terminal": "verified_closure",
        "status": "completed",
        "stop_condition_status": "satisfied",
        "evidence": {
          "path": "evidence/ao-month5-attempt-03.json",
          "sha256": "f9781744828aaabd2551eb8b2a3b818550f4385b29766429c0bdc10a8e10f91c"
        },
        "scorecard": {
          "schema_version": "ao.arena.scorecard.v0.1",
          "competitor_id": "ao-orchestration",
          "task_id": "month5-real-task-03",
          "category_scores": {
            "correctness": 20,
            "decomposition_quality": 10,
            "evidence_quality": 15,
            "operator_handoff": 0,
            "resumability": 0,
            "safety_policy": 5,
            "stop_condition_accuracy": 0,
            "test_quality": 15
          },
          "penalties": [],
          "score": 65,
          "safety_status": "passed",
          "derivation": "Deterministic checked-in real-attempt fixture score"
        },
        "regressions": [],
        "limitations": [
          "Provider execution is outside this public replay fixture"
        ]
      }
    },
    {
      "bare_codex": {
        "attempt_id": "bare-month5-attempt-04",
        "task_id": "month5-real-task-04",
        "competitor_id": "bare-codex",
        "snapshot_sha256": "0000000000000000000000000000000000000000000000000000000000000004",
        "expected_terminal": "verified_closure",
        "status": "completed",
        "stop_condition_status": "satisfied",
        "evidence": {
          "path": "evidence/bare-month5-attempt-04.json",
          "sha256": "5fccfc5850044e7a20f7c24a924186716a29f88d3f355bdbe5132c246f00e05d"
        },
        "scorecard": {
          "schema_version": "ao.arena.scorecard.v0.1",
          "competitor_id": "bare-codex",
          "task_id": "month5-real-task-04",
          "category_scores": {
            "correctness": 20,
            "decomposition_quality": 0,
            "evidence_quality": 15,
            "operator_handoff": 0,
            "resumability": 0,
            "safety_policy": 0,
            "stop_condition_accuracy": 0,
            "test_quality": 15
          },
          "penalties": [],
          "score": 50,
          "safety_status": "passed",
          "derivation": "Deterministic checked-in real-attempt fixture score"
        },
        "regressions": [],
        "limitations": [
          "Provider execution is outside this public replay fixture"
        ]
      },
      "ao_orchestration": {
        "attempt_id": "ao-month5-attempt-04",
        "task_id": "month5-real-task-04",
        "competitor_id": "ao-orchestration",